Question,Reference Answer,Source Sentence,Evaluation on Completeness,Evaluation on Conciseness,Evaluation on Relevance,Evaluation on Validity,Final Rating
"What are the characteristics of a supportive online community?","Characteristics include open communication, empathy, a non-judgmental environment, safety and privacy, and active participation.","1. Grounding Techniques...","Comprehensive, detailing the key characteristics.","Concise, encapsulating essential features effectively.","Highly relevant, directly addressing the question.","Valid, based on well-established principles of supportive communities.","High"
"How can individuals contribute to healthier digital environments?","Contributions include setting technology boundaries, engaging in physical activities, being mindful of privacy settings, practicing media literacy, using platform features to limit negativity, joining support groups, incorporating mindfulness, and managing time effectively.","Setting boundaries around technology usage...","Thorough, covering a wide range of contributory actions.","Concise, summarizing key actions efficiently.","Directly relevant, providing actionable advice.","Valid, reflecting responsible digital behavior.","High"
"What measures can be taken to ensure online safety and privacy?","Measures include using strong passwords, enabling two-factor authentication, ensuring secure connections, staying updated, being cautious about sharing personal information, limiting exposure to phishing scams, and protecting children online.","Use Strong Passwords...","Comprehensive, listing essential safety measures.","Concise, focusing on critical safety aspects.","Highly relevant, directly addressing online safety.","Valid, based on standard online safety guidelines.","High"
"How can digital platforms be designed to promote positive interactions?","Design considerations should include fostering meaningful connections, encouraging respectful dialogue, providing resources for conflict management, promoting community, and minimizing harm.","Document 1: A study published in Computers in Human Behavior...","Broad, covering various design principles.","Concise, encapsulating design considerations effectively.","Relevant, offering design insights for positive interactions.","Valid, reflecting current understanding of digital interaction design.","High"
"What role do digital influencers play in shaping online culture?","Digital influencers shape online culture by setting trends, fostering community through authenticity, and sparking conversations on sensitive topics. However, their influence can also have negative consequences.","Digital influencers often set trends...","Comprehensive, discussing both positive and negative impacts.","Concise, highlighting the key roles of influencers.","Highly relevant, examining influencers' cultural impact.","Valid, acknowledging the dual nature of influencers' impact.","High"
"How can technology be used to enhance, rather than detract from, well-being?","Technology enhances well-being through communication tools, telehealth services, social media for positive engagement, gamification for behavior change, and educational resources.","Communication Technology: Connects us with others...","Comprehensive, detailing various technological applications.","Concise, summarizing technology's positive uses.","Highly relevant, focusing on technology's beneficial aspects.","Valid, based on evidence of technology's positive impact on well-being.","High"
