Question,Reference Answer,Source Sentence,Evaluation on Completeness,Evaluation on Conciseness,Evaluation on Relevance,Evaluation on Validity,Final Rating
"What are some grounding techniques for acute stress and anxiety?","The text offers four grounding techniques for managing acute stress and anxiety: box breathing, progressive muscle relaxation, visualizing calming scenes, and using the five senses to ground oneself. These techniques aim to bring individuals back to the present moment and help alleviate stress and anxiety.","1. Box breathing... You got this!","Covers a range of accessible and practical grounding techniques.","Provides a concise overview of each technique.","Highly relevant, offering specific strategies for stress and anxiety.","Valid, with well-detailed and actionable grounding techniques.","High"
"How can positive affirmations influence emotional well-being?","Positive affirmations, by focusing on positive thoughts, can lead to increased self-esteem, reduced stress, improved mood, and better emotional well-being. They work by replacing negative thoughts with positive beliefs, becoming internalized through repetition, thereby building confidence and resilience.","Positive affirmations are statements...","Comprehensively covers the impact of positive affirmations on emotional well-being.","Details the mechanism of positive affirmations effectively, could be slightly more concise.","Directly relevant, explaining how positive affirmations affect emotional well-being.","Valid, providing a clear explanation of how positive affirmations work.","High"
"What are some effective time management strategies to reduce stress?","The text outlines five time management strategies: creating a daily schedule, prioritizing and delegating tasks, practicing mindfulness, ensuring adequate sleep, and developing good bedtime habits. These strategies aim to manage stress by organizing tasks, promoting relaxation, and maintaining physical and mental health.","1. Create a daily schedule...","Thoroughly addresses various strategies for managing time to reduce stress.","Detailed but could be more concise in summarizing key strategies.","Highly relevant, offering practical time management strategies for stress reduction.","Valid, providing actionable and practical time management tips.","High"
"How can one cultivate emotional resilience in the face of adversity?","To build emotional resilience, the text suggests maintaining a positive mindset, practicing self-care, utilizing grounding techniques, ensuring adequate rest and nutrition, and seeking professional help if overwhelmed. Building resilience involves recognizing and addressing emotions, and fostering emotional strength over time.","and realistic thinking...","Addresses key aspects of building emotional resilience effectively.","Could be more concise by focusing on the main strategies for resilience.","Relevant, offering strategies for developing resilience in adversity.","Valid, with practical advice for building emotional resilience.","Medium"
"What are the benefits of expressive writing for emotional health?","Expressive writing enhances emotional intelligence, boosts self-esteem, encourages healing from trauma, reduces stress levels, and strengthens social connections. By deeply exploring emotions and validating experiences, expressive writing contributes to emotional well-being and stress reduction.","1. Enhances Emotional Intelligence...","Comprehensively covers the emotional health benefits of expressive writing.","Provides detailed benefits, which could be more concise.","Highly relevant, directly linking expressive writing to emotional health benefits.","Valid, with clear and evidence-based benefits of expressive writing.","High"
"How can art therapy serve as a coping mechanism for stress?","Art therapy serves as a coping mechanism by allowing self-expression, emotional release, promoting mindfulness and focus, fostering social connections, and facilitating personal growth. Through creative processes, individuals confront emotions, reduce stress, and develop stronger social bonds, contributing to stress relief.","1. Self-Expression...","Thoroughly covers the ways art therapy can cope with stress.","Detailed, could be condensed for greater conciseness.","Directly relevant, focusing on art therapy's role in stress management.","Valid, with well-supported benefits of art therapy for stress coping.","High"
