Question,Reference Answer,Source Sentence,Evaluation on Completeness,Evaluation on Conciseness,Evaluation on Relevance,Evaluation on Validity,Final Rating
"How does regular physical activity contribute to emotional regulation?","The source sentence seems to discuss strategies for managing emotions rather than specifically how physical activity contributes to emotional regulation.","1. Identify potential triggers: Try to identify situations or activities that tend to trigger intense negative emotions...","The content does not directly address how physical activity contributes to emotional regulation.","The provided strategies for managing emotions are detailed but not concise regarding the role of physical activity.","Not relevant to the specific question about the contribution of physical activity to emotional regulation.","Limited validity in the context of the question, as the focus is on general emotional management strategies.","Low"
"What are some accessible forms of exercise for those new to physical activity?","Accessible forms of exercise include walking, swimming or water aerobics, yoga/tai chi, dancing, cycling, chair exercises, bodyweight training, and incorporating movement into household chores.","1. Walking - This low impact form of aerobic activity doesn't require any special equipment, making it perfect for beginners...","Comprehensively covers a range of accessible exercises for beginners.","Provides a detailed overview of various accessible exercises but could be more concise.","Directly relevant, offering practical suggestions for beginners to start exercising.","Credible, with clear and practical exercise options for those new to physical activity.","High"
"How can exercise routines be tailored to individual needs and preferences?","To tailor exercise routines, one should consult healthcare professionals, assess fitness levels, consider schedules and lifestyle, choose enjoyable exercises, make modifications as needed, and set realistic goals.","To tailor an exercise routine specifically to individual needs and preferences, consider the following...","Thoroughly explores how to personalize exercise routines based on individual preferences and conditions.","Detailed in approach, though could be more concise by summarizing key customization strategies.","Directly relevant, focusing on personalization of exercise routines based on individual needs.","Valid, with sensible and practical steps for tailoring exercise routines to individual preferences.","High"
"What is the connection between physical fitness and psychological well-being?","The source sentence discusses lifestyle changes for mental and physical health, including regular exercise, a balanced diet, quality sleep, managing stress, and nurturing social connections.","To maintain optimal mental and physical health, consider implementing some lifestyle changes...","The content indirectly addresses the connection through suggested lifestyle changes, including exercise.","Provides comprehensive lifestyle recommendations but not concisely focused on the direct connection.","Indirectly relevant, as it covers broader lifestyle factors influencing physical and psychological well-being.","Partially valid, offering general health advice that includes but does not focus on physical fitness's role.","Medium"
"How can group sports and activities enhance social connections and mental health?","Group sports enhance social connections and mental health by fostering teamwork, building trust, expanding social circles, promoting emotional growth, and improving mental resilience.","Group sports and activities offer additional advantages when considering enhancing both social connections and mental health...","Covers the social and mental health benefits of group sports and activities.","Detailed with practical insights but could be more concise by summarizing the social and mental health benefits.","Directly relevant, emphasizing the positive impact of group activities on social connections and mental health.","Credible, providing a well-rounded discussion on the benefits of group sports and activities.","High"
"What are the barriers to regular exercise and how can they be overcome?","Barriers include lack of motivation or energy, time constraints, financial constraints, discomfort or pain, and fear of judgment. Overcoming these involves finding enjoyable activities, setting realistic goals, breaking up workouts, seeking low-cost options, consulting healthcare providers, and focusing on personal achievements.","Barriers to Regular Exercise and How to Overcome Them...","Thoroughly lists common barriers to exercise and provides strategies for overcoming them.","Detailed in addressing each barrier and solution but could be more concise by grouping similar strategies.","Directly relevant, offering solutions to common barriers to maintaining a regular exercise routine.","Valid, with practical and accessible methods for overcoming barriers to regular exercise.","High"
