Question,Reference Answer,Source Sentence,Evaluation on Completeness,Evaluation on Conciseness,Evaluation on Relevance,Evaluation on Validity,Final Rating
"What are the benefits of integrating body awareness practices into daily life?","The benefits include enhanced self-awareness, improved focus and attention, reduced stress and anxiety, emotional resilience, boosted immunity, heightened creativity and cognitive performance, and enhanced relationships.","Based on the provided information and my understanding from various sources including neuroscience research, psychotherapy literature, and personal experiences, integrating body awareness practices into daily life can offer numerous benefits for overall mental and emotional well-being...","Fully captures all listed benefits, providing a comprehensive overview.","Somewhat detailed but could be more focused on the benefits themselves without the introductory clause.","Directly addresses the question with specific benefits of body awareness practices.","The claims are supported by references to studies and literature, adding credibility.","High"
"How can somatic experiencing techniques aid in trauma recovery?","SE techniques aid trauma recovery by helping reestablish safety, process bodily reactions, release emotional energy, and regain nervous system control.","Based on my understanding of the information provided, Somatic Experiencing (SE) techniques can be beneficial for individuals recovering from trauma by helping them reestablish a sense of safety within their body...","Covers the key aspects of SE in trauma recovery effectively.","Direct and to the point, with minimal extraneous information.","Highly relevant to the question, focusing on the therapeutic benefits of SE.","Information appears to be grounded in therapeutic practice, making it valid.","High"
"What role does body awareness play in managing stress and anxiety?","Body awareness aids in recognizing stress signals, reducing anxiety through mindfulness, enhancing emotional regulation, promoting health, encouraging self-compassion, and improving communication.","Body Awareness Helps Recognize Stress Signals - By paying attention to bodily sensations such as tension or increased heart rate, individuals can identify early signs of stress or anxiety...","Covers a broad range of roles body awareness plays in stress and anxiety management.","Provides detailed insights but could be more concise by combining similar points.","Thoroughly pertinent to understanding the role of body awareness in stress management.","Well-grounded in psychological concepts and practices, ensuring validity.","Medium-High"
"How can practices like tai chi and qigong improve mental and physical health?","Tai chi and qigong improve health by reducing stress, enhancing mood, boosting energy, improving balance, lowering blood pressure, strengthening immunity, encouraging self-awareness, and emotional regulation.","Tai Chi and Qigong are mind-body practices that originated from China over a thousand years ago...","Effectively outlines the mental and physical health benefits of tai chi and qigong.","Comprehensive but could streamline the introduction to these practices for brevity.","Directly relates to the question by detailing specific health benefits.","Supported by references to health publications and studies, enhancing validity.","High"
"What are some simple body scanning techniques for relaxation?","Body scanning techniques like PMR and body scan meditation promote relaxation by focusing on muscle tension release and mindfulness of bodily sensations.","Progressive muscle relaxation (PMR) involves tensing and then relaxing each muscle group in the body, starting from toes and working upwards towards head...","Thoroughly describes PMR and body scan meditation techniques for relaxation.","Detail-oriented but could be more succinct by summarizing the processes.","Directly relevant, providing clear examples of body scanning techniques.","Grounded in relaxation and mindfulness practices, ensuring informativeness.","High"
"How can dance and movement therapy support emotional expression and healing?","Dance/movement therapy supports emotional healing by allowing nonverbal expression, releasing tension, exploring emotions, enhancing self-awareness, reducing anxiety, fostering creativity, and improving interpersonal connections.","Dance/movement therapy is a type of expressive arts therapy that utilizes both verbal and nonverbal communication through body movements and dances to improve physical, social, cognitive, and emotional well-being...","Comprehensively addresses how dance/movement therapy supports emotional healing.","Rich in detail, but could consolidate information on therapeutic benefits.","Closely aligned with the question, focusing on emotional expression and healing.","Credible, citing various sources and areas of psychological benefit.","High"
