Question,Reference Answer,Source Sentence,Evaluation on Completeness,Evaluation on Conciseness,Evaluation on Relevance,Evaluation on Validity,Final Rating
"What are some non-verbal strategies for expressing anger constructively?","Maintaining neutral facial expressions, using open body language, speaking clearly and calmly, refraining from physical violence, and acknowledging emotions are non-verbal strategies for expressing anger constructively.","1. Facial expressions - Try to maintain neutral or calm facial expressions when feeling angry...","Addresses various non-verbal strategies comprehensively.","Concise, listing specific strategies.","Directly relevant, focusing on non-verbal expressions.","Valid, offering practical and applicable advice.","High"
"How can one identify triggers for anger and develop proactive coping strategies?","Identifying emotions behind anger, developing awareness of physical signs, practicing mindfulness, challenging negative thoughts, engaging in problem solving, utilizing relaxation techniques, and seeking social support are ways to identify triggers and develop coping strategies.","1) Identify Emotions Behind Anger: Try to recognize when you are feeling angry...","Thoroughly covers identification and coping strategies.","Concise, listing steps clearly.","Directly relevant to identifying triggers and coping.","Valid, based on psychological principles.","High"
"What is the role of communication in managing anger within relationships?","Effective communication, active listening, using 'I' statements, validating feelings, and seeing conflicts as growth opportunities play key roles in managing anger within relationships.","1) Communication plays a crucial role in managing anger within relationships as it allows individuals to express themselves effectively...","Covers key aspects of communication in anger management.","Concise, presenting clear communication strategies.","Directly relevant, focusing on relationship communication.","Valid, offering evidence-based communication techniques.","High"
"How can mindfulness and meditation techniques be applied to anger management?","Mindfulness and meditation increase awareness of anger, allow for a balanced response, explore underlying emotions, and contribute to improved anger management and emotional resilience.","Insightful Response: Hello! I understand that managing anger can sometimes feel like a challenging task...","Addresses how mindfulness and meditation aid anger management.","Concise, summarizing the benefits effectively.","Directly relevant, focusing on mindfulness and meditation.","Valid, with recognized benefits of these techniques.","High"
"What are the long-term consequences of unmanaged anger on health and relationships?","Long-term health consequences include cardiovascular diseases, immune system impact, and gastrointestinal problems. Relationship consequences include damaged communication, increased conflict, and potential for violence.","1) Long term Health Consequences of Unmanaged Anger: - Increased risk for cardiovascular diseases...","Comprehensively addresses both health and relationship consequences.","Concise, listing major consequences.","Directly relevant, linking unmanaged anger to long-term outcomes.","Valid, with well-documented consequences.","High"
"How can one differentiate between healthy and unhealthy expressions of anger?","Healthy expressions of anger involve assertive communication and problem-solving, while unhealthy expressions include verbal aggression, physical harm, holding grudges, and passive-aggressive behavior.","1. Healthy expression of anger might be felt as energy that motivates us to take action against perceived wrongs...","Thoroughly distinguishes between healthy and unhealthy expressions.","Concise, clearly differentiating the two.","Directly relevant, focusing on expressions of anger.","Valid, offering clear examples and explanations.","High"
