Question,Reference Answer,Source Sentence,Evaluation on Completeness,Evaluation on Conciseness,Evaluation on Relevance,Evaluation on Validity,Final Rating
"What are some grounding techniques for acute stress and anxiety?","Effective grounding techniques include deep belly breathing, identifying triggers, engaging in relaxation activities, spending time in nature, connecting socially, using supportive apps and therapy, and avoiding shallow breathing. Awareness and expression of emotions also play a crucial role.","Based on the provided document...","Comprehensive coverage of various grounding techniques.","Concise summary, focusing on key techniques without unnecessary detail.","Highly relevant to the question, outlining multiple grounding strategies.","Valid, offering practical and widely recommended grounding techniques.","High"
"How can positive affirmations influence emotional well-being?","Positive affirmations enhance emotional well-being by promoting gratitude, challenging negative thoughts, supporting positive relationships, encouraging joy-bringing activities, and aiding stress management through deep breathing or muscle relaxation. Seeking professional help when overwhelmed is also suggested.","Practice gratitude regularly...","Addresses the broad impact of affirmations on well-being.","Somewhat concise, though could be more focused on affirmations specifically.","Relevant, explaining how affirmations affect emotional health.","Valid, reflecting common practices in emotional wellness and self-help.","Medium"
"What are some effective time management strategies to reduce stress?","Effective strategies include identifying stress sources, creating a support system, regular exercise, practicing relaxation techniques, seeking professional help, managing exposure to triggers, and developing adaptive coping mechanisms for a balanced lifestyle.","Identifying the Sources...","Covers various strategies for managing time to reduce stress.","Detailed but clear, effectively summarizing strategies.","Relevant to the question, focusing on time management and stress reduction.","Valid, offering practical advice for time management and stress relief.","High"
"How can one cultivate emotional resilience in the face of adversity?","Cultivating emotional resilience involves creating a calming environment, practicing mindfulness, setting boundaries, engaging in joyful activities, seeking social support, learning coping strategies, practicing gratitude, and staying organized.","To increase your emotional safety...","Thoroughly addresses the cultivation of emotional resilience.","Concise, directly addressing key practices for resilience.","Highly relevant, providing strategies for building resilience.","Valid, reflecting recognized approaches to resilience building.","High"
"What are the benefits of expressive writing for emotional health?","Expressive writing enhances emotional health by improving love, vulnerability, emotional openness, social interconnectedness, and self-respect. Recognizing and connecting with emotions enhances emotional intelligence and well-being.","Based on these documents...","Captures the essence of expressive writing's benefits.","Concise and focused on expressive writing's impact on emotional health.","Directly relevant, detailing expressive writing's emotional health benefits.","Valid, supported by studies linking expressive writing and emotional health.","High"
"How can art therapy serve as a coping mechanism for stress?","Art therapy, involving activities like drawing and painting, provides a calming effect, offers a nonverbal communication medium, promotes self-awareness, emotional resilience, and stress reduction through creative self-expression and therapeutic processes.","Art therapy involves using creative activities...","Comprehensive, covering art therapy's role in stress management.","Clear summary, emphasizing art therapy's stress-reducing capabilities.","Highly relevant, directly addressing art therapy's role in coping with stress.","Valid, reflecting art therapy's recognized benefits for stress management.","High"
