Question,Reference Answer,Source Sentence,Evaluation on Completeness,Evaluation on Conciseness,Evaluation on Relevance,Evaluation on Validity,Final Rating
"What are effective strategies for identifying complex emotions?","Reflecting on triggers, practicing emotional awareness, mindfulness, safely expressing emotions, self-compassion, seeking guidance, keeping a mood diary, and learning about emotions are effective strategies.","Based on the provided document...","Thoroughly covers a range of strategies for identifying complex emotions.","Concise, listing strategies clearly without unnecessary detail.","Directly relevant to identifying complex emotions.","Valid, based on common psychological approaches to emotion identification.","High"
"How can emotional granularity improve emotional regulation?","Emotional granularity enhances emotional regulation by enabling the accurate recognition and appropriate response to various emotional states, leading to less reactivity and more intentional responses.","Emotional granularity refers to the ability to identify...","Explains the concept of emotional granularity and its impact on emotional regulation.","Concise, focusing on the benefits of emotional granularity.","Directly relevant to improving emotional regulation.","Valid, referencing research on emotional granularity and its effects.","High"
"What tools or techniques can help in accurately identifying emotions?","Mindfulness meditation, emotional labeling, reflecting on past experiences, social support, and professional help are tools and techniques for identifying emotions.","Practice mindfulness meditation regularly...","Covers various tools and techniques for identifying emotions.","Concise, listing effective tools and techniques.","Directly relevant to the identification of emotions.","Valid, based on commonly recommended practices for emotion identification.","High"
"How does being able to label emotions specifically benefit emotional health?","Labeling emotions specifically improves emotional health by enhancing self-understanding, communication, and emotional processing, leading to better emotional regulation and wellbeing.","Based on the provided document...","Outlines the benefits of labeling emotions for emotional health.","Concise, summarizing key benefits.","Directly relevant to the impact of labeling emotions on emotional health.","Valid, based on psychological principles of emotional awareness and processing.","High"
"Can technology, like apps, aid in emotion recognition and tracking?","Yes, technology like apps can assist in emotion recognition and tracking, offering insights into emotional patterns and helping individuals understand their emotional fluctuations.","Absolutely, technology like apps can aid in emotion recognition...","Affirms the role of technology in aiding emotion recognition and tracking.","Concise, confirming the usefulness of technology.","Directly relevant to the use of technology for emotion recognition and tracking.","Valid, based on the functionality of mood tracking apps and their benefits.","High"
"What is the role of emotional intelligence in personal and professional settings?","Emotional intelligence enhances self-understanding, relationship building, communication, and interpersonal effectiveness, valued in both personal and professional settings for its positive impact on social interactions and job performance.","Emotional Intelligence plays a significant role...","Highlights the importance of emotional intelligence in various settings.","Concise, summarizing the role of emotional intelligence.","Directly relevant to the benefits of emotional intelligence.","Valid, reflecting the consensus on the value of emotional intelligence.","High"
