Question,Reference Answer,Source Sentence,Evaluation on Completeness,Evaluation on Conciseness,Evaluation on Relevance,Evaluation on Validity,Final Rating
"What are the key components of an effective mental health care plan?","Key components include staying positive, ensuring adequate sleep, exercising, maintaining a balanced diet, taking regular breaks, connecting with others, practicing deep breathing, setting small goals, prioritizing personal growth, learning to let go, and seeking professional guidance.","1. Find Ways to Stay Positive...","Comprehensive, covering various aspects of mental health care.","Concise, summarizing key components effectively.","Highly relevant, addressing the core question.","Valid, based on well-accepted mental health practices.","High"
"How can professionals maintain boundaries while providing empathetic care?","Professionals can maintain boundaries by differentiating between empathy and identification, actively listening, setting clear expectations, practicing self-care, encouraging personal growth, and seeking consultation or peer support when needed.","Based on these related information, here are my insights and suggestions for maintaining boundaries while providing empathetic care as a professional...","Thorough, detailing strategies for maintaining boundaries.","Concise, encapsulating key points.","Directly relevant, providing practical advice.","Valid, aligning with professional standards in mental health care.","High"
"What are the latest advancements in psychotherapy for treating depression?","The latest advancements include Cognitive-Behavioral Therapy (CBT), Interpersonal Therapy (IPT), mindfulness practices, psychoeducation, and electroconvulsive therapy (ECT) for severe cases. A personalized treatment approach is crucial.","Research continues to uncover new approaches to effectively treating depression through various forms of talk therapy...","Comprehensive, mentioning various psychotherapy advancements.","Concise, focusing on key advancements.","Highly relevant, directly addressing the question.","Valid, reflecting current research and practices in psychotherapy.","High"
"How does ongoing professional development impact the quality of mental health care?","Ongoing professional development improves mental health care quality by keeping professionals updated on best practices, enhancing therapeutic relationships, and refining skills to better address client needs.","To begin with, let me assure you that seeking therapy is a sign of strength...","Broad, emphasizing the importance of professional development.","Concise, summarizing the impact effectively.","Relevant, linking development to care quality.","Valid, based on principles of continuous learning in healthcare.","High"
"What resources are available for mental health professionals seeking peer support?","Resources include online platforms, conferences, peer supervision, mentoring programs, study clubs, collaborative projects, formal networks, and informational interviews. These provide opportunities for connection, learning, and collaboration.","Hello there! Based on my understanding of your concern regarding accessibility to mental health resources...","Comprehensive, listing a variety of resources.","Concise, summarizing resources succinctly.","Directly relevant, offering specific avenues for peer support.","Valid, based on common practices for professional development and support.","High"
"How can mental health professionals effectively manage their own stress?","Identifying stress roots, setting boundaries, practicing time management, finding joyous activities, building support networks, and maintaining a positive attitude are effective stress management strategies for mental health professionals.","To manage stress, it's essential to identify the root cause...","Comprehensive, detailing multiple strategies.","Concise, capturing essential stress management tips.","Highly relevant, addressing professional stress management.","Valid, reflecting standard stress management techniques.","High"
