Question,Reference Answer,Source Sentence,Evaluation on Completeness,Evaluation on Conciseness,Evaluation on Relevance,Evaluation on Validity,Final Rating
"What are practical steps for balancing online and offline activities?","Implement practices such as setting clear priorities, establishing a routine, developing healthy tech habits, seeking face-to-face interactions, and utilizing organizational tools.","To effectively balance online and offline activities, consider implementing the following practices...","Comprehensive, covering essential practices for balance.","Concise, with clear steps outlined.","Directly relevant, addressing the question's core.","Valid, with actionable steps for balancing activities.","High"
"How can digital detox periods contribute to mental well-being?","Detox periods can reduce stress, improve focus and productivity, enhance personal relationships, encourage self-reflection, and promote better sleep.","Digital Detox Periods Contribute To Mental Well-Being In Several Ways...","Covers a range of well-being improvements.","Concise, summarizing detox benefits.","Relevant, explaining detox periods' impact.","Valid, with insights into detox benefits.","High"
"What are the signs of excessive screen time and how can it be reduced?","Signs include long usage without breaks, neglecting routines, restlessness away from screens, and concentration difficulties. Reduction strategies involve setting specific times for digital activities, scheduling breaks, monitoring usage, finding alternative activities, and seeking offline connections.","The signs of excessive screen time include...","Addresses signs and reduction strategies.","Concise, summarizing key signs and strategies.","Directly relevant, focusing on screen time impacts.","Valid, with practical advice for reduction.","High"
"How can individuals set realistic and healthy limits on their digital device usage?","Set clear boundaries, establish routines, encourage breaks, monitor online activities, create a conducive environment, and involve the family in technology use guidelines.","To help your son develop healthy digital habits, setting clear boundaries around screen time usage could be beneficial...","Comprehensive, offering detailed steps for setting limits.","Concise, summarizing key actions for limit setting.","Relevant, focusing on digital device usage management.","Valid, with actionable advice for setting limits.","High"
"What are some alternative activities to screen-based entertainment?","Alternatives include hobbies like painting, physical activities, cultural events, volunteer work, socializing, learning new skills or languages, cooking, gardening, mindfulness practices, and sports.","Consider exploring hobbies such as painting, drawing, writing...","Extensive, covering various activities.","Concise, with clear alternatives listed.","Relevant, offering options to screen entertainment.","Valid, with practical suggestions for activities.","High"
"How can families create and enforce screen time rules for children and teenagers?","Families can create and enforce rules by discussing screen time's importance, involving children in setting goals, establishing routines, monitoring adherence, involving other adults, being consistent, and viewing mistakes as growth opportunities.","Insight: Creating and enforcing screen time rules for children and teenagers requires effective communication and setting clear expectations...","Addresses rule creation and enforcement.","Concise, summarizing family strategies.","Directly relevant, focusing on family dynamics.","Valid, with actionable advice for families.","High"
