Question,Reference Answer,Source Sentence,Evaluation on Completeness,Evaluation on Conciseness,Evaluation on Relevance,Evaluation on Validity,Final Rating
"What are some grounding techniques for acute stress and anxiety?","Grounding techniques for managing acute stress and anxiety include deep belly breathing, mindfulness practices, gradual exposure to feared situations, positive self-talk, seeking therapy, journaling, avoiding stimulants, regular exercise, adequate sleep, balanced diet, relaxation techniques, social connections, and maintaining a healthy lifestyle. It's crucial to find what works best for you and seek professional advice if needed.","Based on the provided text, some grounding techniques for acute stress and anxiety include practicing deep belly breathing...","Thorough, covering a broad range of techniques.","Concise, effectively summarizing without excessive detail.","Highly relevant, directly addressing the question.","Valid, reflecting established methods for managing stress and anxiety.","High"
"How can positive affirmations influence emotional well-being?","Positive affirmations can enhance emotional well-being by boosting self-esteem, reducing stress, and fostering resilience. They encourage a positive self-image and mindset, reinforced through repetition. It's important to choose resonant affirmations and complement them with self-care practices for the best outcome.","Affirmation practice involves regularly repeating positive statements about yourself to improve your self-image and overall mindset...","Comprehensive, highlighting the benefits and how-to of affirmations.","Concise, focusing on the essence of how affirmations work.","Directly relevant, clearly explaining the impact of affirmations on well-being.","Valid, backed by psychological benefits recognized in studies.","High"
"What are some effective time management strategies to reduce stress?","Effective time management strategies include identifying stress sources, prioritizing tasks, setting realistic goals, managing time with tools like calendars, delegating tasks, taking regular breaks, exercising, eating well, getting enough sleep, and practicing mindfulness. These strategies help tackle overwhelm and enhance productivity and well-being.","Identifying the root cause: Take some time to identify the primary source of your stress...","Thoroughly covers a range of strategies for time management.","Concise, summarizing key strategies succinctly.","Highly relevant, offering practical advice for managing time to reduce stress.","Valid, incorporating recognized time management and stress reduction techniques.","High"
"How can one cultivate emotional resilience in the face of adversity?","To build emotional resilience, practice mindfulness, challenge limiting beliefs, connect with supportive people, engage in relaxing activities, and take regular breaks. Recognizing and addressing underlying emotions like anger in healthy ways is also crucial. Developing resilience is a gradual process that enhances mental and emotional well-being.","Anger is a common response to fear and insecurity...","Comprehensive, addressing both the emotional aspects and practical strategies.","Concise, summarizing key points effectively.","Directly relevant, providing strategies to build resilience.","Valid, offering practical and psychologically sound advice.","High"
"What are the benefits of expressive writing for emotional health?","Expressive writing benefits emotional health by improving coping with emotions, self-awareness, stress reduction, creativity, and psychological well-being. It allows for exploration and understanding of complex feelings and fosters a deeper sense of self-connection. Regular practice enhances emotional intelligence and personal growth.","Based on these documents, I believe the key benefits of expressive writing for emotional health include improved ability to cope with emotions...","Comprehensively covers the benefits of expressive writing.","Concise, focusing on the significant benefits without extraneous details.","Highly relevant, directly addressing the benefits of expressive writing.","Valid, reflecting the recognized psychological benefits of expressive writing.","High"
"How can art therapy serve as a coping mechanism for stress?","Art therapy serves as a coping mechanism by providing a creative outlet for expressing emotions nonverbally, promoting relaxation and insight into emotional states. It offers a unique approach to stress management, improving mental well-being through the therapeutic creation of art.","Art therapy serves as a coping mechanism for stress by providing a creative outlet for emotions...","Thorough, outlining the process and benefits of art therapy for stress.","Concise, capturing the essence of art therapy's role in stress management.","Directly relevant, explaining how art therapy can help with stress.","Valid, based on the therapeutic principles of art therapy.","High"
