Question,Reference Answer,Source Sentence,Evaluation on Completeness,Evaluation on Conciseness,Evaluation on Relevance,Evaluation on Validity,Final Rating
"How does regular physical activity contribute to emotional regulation?","The text emphasizes the importance of mental health care and encourages reaching out for support but does not directly address how physical activity contributes to emotional regulation.","I hope my answers were helpful! Let me know if there's anything else you'd like to discuss or if you have any further questions...","Does not address how physical activity contributes to emotional regulation.","The response is brief and to the point but off-topic.","Not relevant to the question about physical activity's role in emotional regulation.","Lacks informative value regarding the question's focus.","Low"
"What are some accessible forms of exercise for those new to physical activity?","Provides a comprehensive list of low-impact and beginner-friendly exercises like walking, swimming, yoga, bodyweight training, dancing, tai chi, and cycling, highlighting their benefits and adaptability for newcomers to physical activity.","1. Walking: This low impact aerobic activity involves taking brisk walks...","Covers a range of accessible exercises for beginners, addressing the question.","Detailed and informative, though conciseness could be improved by summarizing.","Highly relevant, offering practical suggestions for beginners.","Valid, presenting practical and accessible exercise options for those new to physical activity.","High"
"How can exercise routines be tailored to individual needs and preferences?","To tailor exercise routines, one should consult healthcare professionals, consider personal interests, adapt workout intensity, ensure convenience, set realistic goals, seek advice, embrace flexibility, track progress, stay engaged, and connect with supportive communities.","To tailor an exercise routine to an individual's unique needs and preferences, here are several recommendations: 1) Consult with a healthcare provider...","Thoroughly addresses how to personalize exercise routines to individual needs.","The answer is detailed, could be more concise by highlighting key points.","Directly relevant, providing actionable steps for customizing exercise routines.","Valid, offering practical and actionable advice for tailoring exercise routines.","High"
"What is the connection between physical fitness and psychological well-being?","The text discusses the supportive role of exercise in mental health, the therapeutic process and its distinction from exercise and medication, emphasizing a holistic approach to well-being that includes therapy, medication, and physical fitness.","It seems that you mentioned earlier that exercise might not fully control mental illnesses alone but rather serve as a component within a comprehensive approach...","Provides a nuanced explanation of the multifaceted approach to mental health, including the role of physical fitness.","Detailed explanation but could benefit from focusing more succinctly on the direct connection.","Relevant, explaining how physical fitness complements therapy and medication in mental health care.","Valid, offering a deep insight into the holistic approach to mental well-being.","High"
"How can group sports and activities enhance social connections and mental health?","Group sports and activities enhance social connections and mental health by fostering camaraderie, reducing anxiety, boosting confidence, increasing resilience, and improving focus, among other benefits.","1. Group Sports and Activities Enhance Social Connections: When we participate in group sports or activities, we engage in meaningful interactions with others...","Thoroughly covers how group activities can enhance social connections and mental health.","Provides a detailed explanation of the benefits, could be more concise.","Directly relevant, highlighting various ways group activities contribute to mental health.","Valid, accurately presenting the psychological and social benefits of group activities.","High"
"What are the barriers to regular exercise and how can they be overcome?","Identifies common barriers to exercise like fear, time constraints, financial limitations, lack of motivation, health concerns, social pressures, and traumatic experiences, offering practical solutions for each.","1. Fear/lack of confidence - Try taking small steps towards achieving your goal...","Comprehensively addresses common barriers to exercise and offers solutions.","Detailed but could be condensed to focus on overarching strategies for overcoming barriers.","Highly relevant, providing actionable advice for overcoming obstacles to regular exercise.","Valid, offering practical strategies to address common exercise barriers.","High"
