Question,Reference Answer,Source Sentence,Evaluation on Completeness,Evaluation on Conciseness,Evaluation on Relevance,Evaluation on Validity,Final Rating
"What are the mental health benefits of incorporating yoga into one's routine?","The text initially provides strategies for dealing with spiritual discord but then describes yoga's mental health benefits like reduced stress, improved mood, and increased self-awareness. To start, it suggests local classes or online resources and emphasizes consistency.","1. Practice gratitude... To get started with yoga for mental health benefits...","Addresses the mental health benefits of yoga comprehensively.","Provides a detailed overview, which could be more concise by focusing solely on yoga's benefits.","Highly relevant, offering clear benefits and practical steps to start yoga.","Valid, with actionable advice on beginning yoga for mental health.","High"
"How can beginners approach mindful movement practices safely and effectively?","For beginners, the text recommends starting small, listening to the body, practicing regularly, considering professional guidance, creating a peaceful environment, focusing on breath, and maintaining a nonjudgmental attitude to safely and effectively engage in mindful movement practices.","To approach mindful movement practices safely and effectively...","Thoroughly covers safe and effective approaches for beginners.","Details numerous strategies, fitting the question's scope but could be more succinct.","Directly relevant, offering practical strategies for beginners.","Valid, providing actionable and safe steps for beginners to start mindful movement.","High"
"What are the different styles of yoga, and how do they impact mental health?","The text discusses the benefits of meditation and yoga for mental well-being, mentioning mindfulness meditation's stress reduction and yoga's contribution to mental health through physical postures, breathwork, and meditation, without detailing different yoga styles.","Hello! How can I assist you today regarding meditation and yoga for mental health?...","Provides general benefits of yoga for mental health but does not detail different styles.","Offers broad benefits of yoga and meditation, could be more concise and focused on yoga styles.","Somewhat relevant by discussing yoga's mental health benefits but lacks details on different styles.","Valid in highlighting yoga's mental health benefits, but incomplete regarding yoga styles.","Medium"
"How can yoga be used as a tool for stress management and relaxation?","The text suggests progressive muscle relaxation, sleep hygiene, healthy eating, physical activity, and creative hobbies as strategies for stress management, without directly explaining how yoga serves this purpose.","Another useful strategy is to engage in progressive muscle relaxation (PMR)...","Does not specifically address how yoga contributes to stress management and relaxation.","Provides extensive strategies for stress management, though not directly related to yoga.","Not directly relevant to using yoga for stress management and relaxation.","Valid strategies for stress management, but lacks information on yoga's role.","Low"
"What are the principles behind the mind-body connection in yoga practice?","The text offers strategies for stress management like self-awareness, grounding techniques, exercise, balanced diet, sleep, social connection, creative expression, and time management, without detailing the specific principles of the mind-body connection in yoga.","1. Self-awareness: Recognize how your body feels when stressed or anxious...","Does not specifically address the principles behind the mind-body connection in yoga.","Provides detailed strategies for stress management, not directly related to yoga's mind-body principles.","Not directly relevant to the mind-body connection principles in yoga.","Valid strategies for stress management, but lacks focus on yoga's mind-body principles.","Low"
"How can mindful movement be integrated into daily activities for stress reduction?","The text suggests incorporating stretching, mindful walking, hobbies, resistance training during chores, mindful eating, and self-care sessions into daily life for stress reduction, emphasizing consistency and prioritization of mindful movements.","Integrating mindful movements into daily activities can be done in several ways...","Comprehensively addresses integrating mindful movement into daily life for stress reduction.","Details several strategies concisely within the context of the question.","Highly relevant, offering practical ways to integrate mindful movement for stress reduction.","Valid, providing actionable steps to incorporate mindful movement into daily activities.","High"
