Question,Reference Answer,Source Sentence,Evaluation on Completeness,Evaluation on Conciseness,Evaluation on Relevance,Evaluation on Validity,Final Rating
"What are the mental health benefits of a plant-based diet?","Whole foods, adequate micronutrients, fortified foods and supplements, hydration, portion control, reduced added sugars, mindful eating, regular meals.","1. Choose whole foods: Aim to eat a variety of fruits, vegetables, legumes, nuts, seeds, and whole grains daily...","The response outlines several key components of a plant-based diet that could contribute to mental health benefits, addressing the question comprehensively.","The answer is detailed and directly focused on the aspects of a plant-based diet relevant to mental health.","The response is directly relevant to the mental health benefits of a plant-based diet.","The information provided is consistent with nutritional science and its implications for mental health.","High"
"How can regular outdoor activities support mental well-being?","Social connections, inspiration from nature, physical activities, gratitude journaling.","1) Consider reaching out to friends/community groups - Perhaps consider joining a hobby group, sports team or volunteering organization...","Covers multiple ways in which outdoor activities can enhance mental well-being, from reducing stress to fostering social connections.","The answer provides a concise overview of the benefits without unnecessary detail.","The response is directly related to how outdoor activities can support mental well-being.","The benefits mentioned are supported by research in the fields of psychology and environmental health.","High"
"What role does a consistent sleep schedule play in emotional health?","Relaxation techniques, soothing pre-sleep ritual, avoiding caffeine and screens, gentle self-response to sleeplessness, physical exercise, sleep diary.","1. Consider exploring relaxation techniques like deep breathing exercises, progressive muscle relaxation, meditation, yoga or mindfulness practices...","Thoroughly explains the importance of a consistent sleep schedule and offers practical advice for enhancing sleep quality.","The response is focused and provides actionable suggestions without veering off-topic.","Directly addresses the role of a consistent sleep schedule in maintaining emotional health.","The recommendations are based on established sleep hygiene principles and their known benefits to emotional health.","High"
"How do hobbies and leisure activities contribute to mental health?","Brain function, confidence, relaxation, social connection, distraction from negative thoughts.","Hobbies and Leisure Activities play a vital role in promoting mental health and well-being...","Effectively highlights the diverse benefits of hobbies and leisure activities on mental health.","The response efficiently conveys the benefits without unnecessary elaboration.","Closely aligns with the question, detailing how hobbies and leisure activities support mental health.","The described benefits are widely recognized in the fields of psychology and mental health.","High"
"What impact does hydration have on cognitive function and mood?","Cognitive function impairment, mood effects, oxidative stress, brain cell inflammation.","1) Hydration plays a significant role in both cognitive function and mood regulation...","Addresses the impact of hydration on cognitive function and mood in detail.","The response is to the point, focusing on hydration's impact without straying from the topic.","Directly relevant to the question, explaining how hydration influences both cognitive function and mood.","The information is consistent with hydration research and its known effects on cognitive and emotional health.","High"
"In what ways can social connections and community involvement boost mental well-being?","Reduces stress, enhances positive emotions, boosts confidence, provides purpose, encourages healthy behaviors, protection against depression and anxiety.","------------------------------\n\n        Based on the provided text, social connections and community involvement can significantly improve mental well-being in several ways...","Comprehensively outlines the benefits of social connections and community involvement for mental well-being.","The answer provides a succinct overview of the benefits without unnecessary detail.","Directly pertinent to how social connections and community involvement can enhance mental well-being.","The benefits described are supported by psychological research on social connections and mental health.","High"
